{
  "$schema": "https://json-schema.org/draft/2020-12/schema",
  "title": "banco.lesson_review/1",
  "type": "object",
  "additionalProperties": false,
  "required": [
    "schema",
    "schema_version",
    "revision",
    "checklist",
    "recomputed",
    "findings"
  ],
  "properties": {
    "schema": {
      "const": "banco.lesson_review/1"
    },
    "schema_version": {
      "const": 1
    },
    "revision": {
      "type": "string",
      "minLength": 1,
      "maxLength": 64,
      "pattern": "^[A-Za-z0-9_-]+$"
    },
    "checklist": {
      "type": "array",
      "prefixItems": [
        {
          "type": "object",
          "additionalProperties": false,
          "required": [
            "id",
            "result",
            "evidence"
          ],
          "properties": {
            "id": {
              "const": 1
            },
            "result": {
              "enum": [
                "pass",
                "fail",
                "na"
              ]
            },
            "evidence": {
              "type": "string",
              "minLength": 12,
              "maxLength": 1200
            }
          }
        },
        {
          "type": "object",
          "additionalProperties": false,
          "required": [
            "id",
            "result",
            "evidence"
          ],
          "properties": {
            "id": {
              "const": 2
            },
            "result": {
              "enum": [
                "pass",
                "fail",
                "na"
              ]
            },
            "evidence": {
              "type": "string",
              "minLength": 12,
              "maxLength": 1200
            }
          }
        },
        {
          "type": "object",
          "additionalProperties": false,
          "required": [
            "id",
            "result",
            "evidence"
          ],
          "properties": {
            "id": {
              "const": 3
            },
            "result": {
              "enum": [
                "pass",
                "fail",
                "na"
              ]
            },
            "evidence": {
              "type": "string",
              "minLength": 12,
              "maxLength": 1200
            }
          }
        },
        {
          "type": "object",
          "additionalProperties": false,
          "required": [
            "id",
            "result",
            "evidence"
          ],
          "properties": {
            "id": {
              "const": 4
            },
            "result": {
              "enum": [
                "pass",
                "fail",
                "na"
              ]
            },
            "evidence": {
              "type": "string",
              "minLength": 12,
              "maxLength": 1200
            }
          }
        },
        {
          "type": "object",
          "additionalProperties": false,
          "required": [
            "id",
            "result",
            "evidence"
          ],
          "properties": {
            "id": {
              "const": 5
            },
            "result": {
              "enum": [
                "pass",
                "fail",
                "na"
              ]
            },
            "evidence": {
              "type": "string",
              "minLength": 12,
              "maxLength": 1200
            }
          }
        },
        {
          "type": "object",
          "additionalProperties": false,
          "required": [
            "id",
            "result",
            "evidence"
          ],
          "properties": {
            "id": {
              "const": 6
            },
            "result": {
              "enum": [
                "pass",
                "fail",
                "na"
              ]
            },
            "evidence": {
              "type": "string",
              "minLength": 12,
              "maxLength": 1200
            }
          }
        },
        {
          "type": "object",
          "additionalProperties": false,
          "required": [
            "id",
            "result",
            "evidence"
          ],
          "properties": {
            "id": {
              "const": 7
            },
            "result": {
              "enum": [
                "pass",
                "fail",
                "na"
              ]
            },
            "evidence": {
              "type": "string",
              "minLength": 12,
              "maxLength": 1200
            }
          }
        },
        {
          "type": "object",
          "additionalProperties": false,
          "required": [
            "id",
            "result",
            "evidence"
          ],
          "properties": {
            "id": {
              "const": 8
            },
            "result": {
              "enum": [
                "pass",
                "fail",
                "na"
              ]
            },
            "evidence": {
              "type": "string",
              "minLength": 12,
              "maxLength": 1200
            }
          }
        }
      ],
      "items": false,
      "minItems": 8
    },
    "recomputed": {
      "type": "array",
      "maxItems": 60,
      "items": {
        "type": "object",
        "additionalProperties": false,
        "required": [
          "where",
          "n",
          "expression",
          "value"
        ],
        "properties": {
          "where": {
            "enum": [
              "example",
              "try",
              "solutions",
              "idea",
              "mistakes"
            ]
          },
          "n": {
            "anyOf": [
              {
                "type": "null"
              },
              {
                "type": "integer",
                "minimum": 1,
                "maximum": 12
              }
            ]
          },
          "expression": {
            "type": "string",
            "minLength": 1,
            "maxLength": 300
          },
          "value": {
            "type": "string",
            "minLength": 1,
            "maxLength": 120
          }
        }
      }
    },
    "findings": {
      "type": "array",
      "maxItems": 30,
      "items": {
        "type": "object",
        "additionalProperties": false,
        "required": [
          "severity",
          "section",
          "quote",
          "problem_it",
          "fix_it"
        ],
        "properties": {
          "severity": {
            "enum": [
              "blocker",
              "major",
              "minor"
            ]
          },
          "section": {
            "enum": [
              "why",
              "idea",
              "example",
              "mistakes",
              "try",
              "solutions",
              "book",
              "summary",
              "frontmatter"
            ]
          },
          "exercise": {
            "anyOf": [
              {
                "type": "null"
              },
              {
                "type": "integer",
                "minimum": 1,
                "maximum": 12
              }
            ]
          },
          "quote": {
            "type": "string",
            "minLength": 1,
            "maxLength": 500
          },
          "problem_it": {
            "type": "string",
            "minLength": 1,
            "maxLength": 600
          },
          "fix_it": {
            "type": "string",
            "minLength": 1,
            "maxLength": 600
          }
        }
      }
    }
  }
}
